{
  "schema": "sourcefold.spell.v0",
  "id": "coc:spell:create-amulet",
  "kind": "spell",
  "name": {
    "ru": "Создать амулет",
    "en": "Create Amulet"
  },
  "aliases": [
    "Stone of Blessing",
    "Healing Stone",
    "Snake Gem"
  ],
  "category": "зачарование",
  "cost": {
    "raw": "10 ПМ, 10 МОЩ, 1 Рассудка",
    "magic_points": "10",
    "sanity": "1",
    "pow": "10",
    "other": "полудрагоценный камень; личная жертва будущего владельца"
  },
  "casting_time": {
    "raw": "1 неделя"
  },
  "description": {
    "ru": "Чародей изготавливает амулет из полудрагоценного камня: каждый вид камня обладает своим свойством, определяющим силы амулета, а вырезанные на нём чародеем изображения их усиливают. После изготовления тот, кто будет носить амулет, должен пожертвовать чем-то лично для себя дорогим.\nЗачарованный амулет, который носят на шее как подвеску или при себе, раз в 24 часа позволяет призвать на помощь «сверхъестественного стража» — бесплотную сущность (её природу определяет Хранитель). Раз в 24 часа она оказывает одну из услуг: исцелить 5 пунктов урона; повысить МОЩ, СИЛ, ВЫН или ЛВК носителя на 10 на один час.\nЕсли амулет осквернить или сломать, он теряет силу. Сколько сущность будет одаривать владельца, чародеи спорят: говорят, что порой сущности устают и злятся на постоянное истощение, обращают благо в проклятие или ищут иные пути освободиться от зова амулета.",
    "en": null
  },
  "variant_of": null,
  "axes": {
    "era": [
      "any"
    ],
    "ruleset": "core"
  },
  "sources": [
    {
      "book_id": "grand-grimoire-en",
      "physical_page": 83,
      "printed_page": 82,
      "method": "book_text",
      "verified": true
    }
  ],
  "quality": {
    "needs_review": false,
    "flags": [
      "translated"
    ],
    "notes": "Только Grand Grimoire; текст — наш перевод. Альтернативные названия в GG зависят от свойства амулета («Камень благословения», «Целительный камень», «Змеиный самоцвет» и т. п.). Слитый ранее дубликат помощника «Создание оберега (народное)» (spell-sozdanie-oberega-narodnoe, «Маски») оказался другим заклинанием — Create Charm (Folk), см. coc:spell:create-charm-folk; его алиасы и поправка цены убраны."
  }
}
