{
  "schema": "sourcefold.spell.v0",
  "id": "coc:spell:defy-gravity",
  "kind": "spell",
  "name": {
    "ru": "Преодолеть притяжение",
    "en": "Defy Gravity"
  },
  "aliases": [
    "The Topsy-Turvy Rite",
    "Mastery of Elements",
    "Principles of Force"
  ],
  "category": "Врата и путешествия",
  "cost": {
    "raw": "5 ПМ, 1d3 Рассудка",
    "magic_points": "5",
    "sanity": "1d3",
    "pow": null,
    "other": null
  },
  "casting_time": {
    "raw": "мгновенно"
  },
  "description": {
    "ru": "Заклинатель поворачивает притяжение для собственного тела на 90 или 180 градусов на 4d6 раундов: он может ходить по стене как по полу или упасть на потолок и ходить по нему (удобный способ спрятаться в тёмной комнате). Препятствия, смену поверхности и прочее разыгрывайте как обычно. Длительность Хранитель всегда бросает втайне. Тот, кто падает, когда обычное притяжение возвращается, может получить урон от падения в зависимости от высоты.",
    "en": null
  },
  "deeper_magic": {
    "ru": "Заклинатель может распространить действие на всех в пределах 3 метров от себя. Колдун, известный лишь как Шудук, верил, что усиленная версия заклинания способна забросить его с Земли на Луну и дальше; по рассказам, на месте, где он, как считается, попытался это сделать, нашли лишь жуткое багровое месиво.",
    "en": null
  },
  "variant_of": null,
  "axes": {
    "era": [
      "any"
    ],
    "ruleset": "core"
  },
  "sources": [
    {
      "book_id": "grand-grimoire-en",
      "physical_page": 95,
      "printed_page": 94,
      "method": "book_text",
      "verified": true
    }
  ],
  "quality": {
    "needs_review": false,
    "flags": [
      "translated"
    ],
    "notes": null
  }
}
