{
  "schema": "sourcefold.spell.v0",
  "id": "coc:spell:bless-blade",
  "kind": "spell",
  "name": {
    "ru": "Благословение клинка",
    "en": "Bless Blade"
  },
  "aliases": [
    "Imbue Might of the Elder Ones",
    "Ritual of the Seven Cuts",
    "Spirit’s Bane",
    "Наделить мощью Древних",
    "Ритуал семи надрезов",
    "Погибель духов"
  ],
  "category": "Зачарование",
  "cost": {
    "raw": "5 МОЩ, 1d4 Рассудка",
    "magic_points": null,
    "sanity": "1d4",
    "pow": "5",
    "other": "кровь животного с ТЕЛ не менее 50"
  },
  "casting_time": {
    "raw": "1 час"
  },
  "description": {
    "ru": "Создаёт клинок, способный ранить и даже убить существ, неуязвимых для обычного оружия. Для ритуала нужно принести в жертву кровь животного с ТЕЛ не менее 50. Клинок должен быть из чистого металла без примесей — например, железа или серебра. Размер клинка любой; чем он больше, тем больше урона наносит (урон — по таблице оружия для этого вида клинка).\nЕсли благословлённый клинок сломать, расплавить или иначе повредить, он навсегда теряет это свойство; но при ударах по сверхъестественным существам сам клинок повреждений не получает.\nПо Grand Grimoire, подходит любое клинковое оружие (нож, меч), а жертвенных животных может быть несколько с общим ТЕЛ 50+.",
    "en": null
  },
  "variant_of": null,
  "axes": {
    "era": [
      "any"
    ],
    "ruleset": "core"
  },
  "sources": [
    {
      "book_id": "keeper-rulebook-ru",
      "physical_page": 225,
      "printed_page": 244,
      "method": "book_text",
      "verified": true
    },
    {
      "book_id": "keeper-rulebook-en",
      "physical_page": 247,
      "printed_page": 246,
      "method": "book_text",
      "verified": true
    },
    {
      "book_id": "grand-grimoire-en",
      "physical_page": 45,
      "printed_page": 44,
      "method": "book_text",
      "verified": true
    }
  ],
  "quality": {
    "needs_review": false,
    "flags": [],
    "notes": "Grand Grimoire уточняет время сотворения — не менее часа."
  }
}
