{
  "schema": "sourcefold.spell.v0",
  "id": "coc:spell:command-animal-folk",
  "kind": "spell",
  "name": {
    "ru": "Повелевать животным",
    "en": "Command Animal (Folk)"
  },
  "aliases": [
    "Command Animal",
    "Beast Mastery",
    "Call Forth the Crawling Ones for Thy Bidding",
    "Compel (Animal)",
    "Speak with (Animal)",
    "Повелевать зверем (народное)"
  ],
  "category": "Контроль и разум",
  "cost": {
    "raw": "1 ПМ, 1d3 Рассудка",
    "magic_points": "1",
    "sanity": "1d3",
    "pow": null,
    "other": null
  },
  "casting_time": {
    "raw": "1 раунд"
  },
  "description": {
    "ru": "Заставляет одно животное определённого вида выполнить один приказ. Каждая версия заклинания относится к своему виду (так, «Повелевать вороном» действует только на врановых) и изучается отдельно; могут существовать заклинания для любых природных животных — колонны муравьёв-кочевников, зелёной мамбы, леопарда, ворона, змеи, акулы, паукообразной обезьяны.\nЖивотное приходит к заклинателю естественным путём и обязано выполнить один его приказ, даже напасть на сородичей; выполнив его, оно освобождается, и сутки его нельзя подчинить снова. Приказ должен быть простым, конкретным, наглядным и ограниченным по времени: «защищай меня вечно» недопустимо, «убей того человека» — допустимо. Можно велеть что-то отнести, присутствовать на церемонии, напасть или появиться где-то поблизости в качестве предупреждения. Животное начинает действовать в раунде после сотворения.\nЗаклинатель должен видеть животное, а приказ должен быть понятен и выполним для него. Обычно действие длится до выполнения приказа; если животному помешать (подстрелить, обездвижить), чары слабеют. Если помешать нельзя, заклинание угасает по выполнении задачи или через 1d10+5 минут — что наступит раньше.",
    "en": null
  },
  "variant_of": null,
  "axes": {
    "era": [
      "any"
    ],
    "ruleset": "core"
  },
  "sources": [
    {
      "book_id": "grand-grimoire-en",
      "physical_page": 69,
      "printed_page": 68,
      "method": "book_text",
      "verified": true
    },
    {
      "book_id": "masks-of-nyarlathotep-en",
      "physical_page": 634,
      "printed_page": 631,
      "method": "book_text",
      "verified": true
    }
  ],
  "quality": {
    "needs_review": false,
    "flags": [
      "translated"
    ],
    "notes": "Только Grand Grimoire; текст — наш перевод. Дубликат помощника «Повелевать зверем (народное)» («Маски») слит сюда; «Маски» (машинный перевод) пока не использованы. Сверено с английскими «Масками» 7e (с. 631–632): цена, время и механика совпадают."
  }
}
