{
  "schema": "sourcefold.spell.v0",
  "id": "coc:spell:alter-weather",
  "kind": "spell",
  "name": {
    "ru": "Изменить погоду",
    "en": "Alter Weather"
  },
  "aliases": [
    "Master the Elements",
    "Rain Dance",
    "Gatherer of Storms"
  ],
  "category": "окружающая среда",
  "cost": {
    "raw": "10+ ПМ, 1 Рассудка",
    "magic_points": "10+",
    "sanity": "1",
    "pow": null,
    "other": null
  },
  "casting_time": {
    "raw": "3+ минуты"
  },
  "description": {
    "ru": "Смягчает или усиливает погоду; большие группы могут добиться более сильных изменений. Исходную погоду задаёт Хранитель. Каждые 10 пожертвованных ПМ дают одну ступень изменения. Заклинатель вкладывает сколько угодно ПМ, как и любой участник, знающий заклинание; не знающие его могут добавить только по 1 ПМ. Каждый участник теряет 1 Рассудка; на каждую ступень изменения нужно три минуты напевного песнопения.\nБазовый радиус — около 3 км; каждые дополнительные 1,6 км радиуса стоят ещё 10 ПМ. Изменение держится 30 минут на каждые 10 вложенных ПМ, но буйная погода вроде торнадо длится гораздо меньше.\nМеняются пять составляющих погоды, по ступеням (одна ступень — 10 ПМ; например, от «переменной облачности» до «сплошных туч» — две ступени, 20 ПМ):\n• облачность: ясно — туман — переменная облачность — облачно — сплошные тучи;\n• направление ветра: С — СВ — В — ЮВ — Ю — ЮЗ — З — СЗ;\n• сила ветра: штиль — бриз — порывистый — сильный ровный — шторм — ураган — торнадо;\n• температура: каждая ступень повышает или понижает её примерно на 3 °C;\n• осадки: сухо — морось или дымка — дождь [снег] — град [снег] — ливень [сильный снегопад] — гроза [буран].\nСнег идёт, только если температура не выше −1 °C, иначе выпадает дождь.",
    "en": null
  },
  "variant_of": null,
  "axes": {
    "era": [
      "any"
    ],
    "ruleset": "core"
  },
  "sources": [
    {
      "book_id": "grand-grimoire-en",
      "physical_page": 28,
      "printed_page": 27,
      "method": "book_text",
      "verified": true
    }
  ],
  "quality": {
    "needs_review": false,
    "flags": [
      "translated"
    ],
    "notes": null
  }
}
