{
  "schema": "sourcefold.spell.v0",
  "id": "coc:spell:eviscerator",
  "kind": "spell",
  "name": {
    "ru": "Потрошитель",
    "en": "Eviscerator"
  },
  "aliases": [
    "Cacophony of Doom",
    "Black Bolts of Death",
    "Judgment of P’Tan"
  ],
  "category": "атака",
  "cost": {
    "raw": "переменное число ПМ, 2d6 Рассудка",
    "magic_points": "варьируется",
    "sanity": "2d6",
    "pow": null,
    "other": null
  },
  "casting_time": {
    "raw": "2 раунда"
  },
  "description": {
    "ru": "Работает только в Стране снов. В цель летит клубок чёрных зазубренных осколков, тёмно-фиолетовых вспышек тумана и красно-жёлтых разрядов энергии. Потрошитель вспарывает жертву, нанося 1d6 урона за каждые 8 вложенных в заклинание ПМ. Противостоять атаке цель не может, но надетая броня уменьшает урон.",
    "en": null
  },
  "variant_of": null,
  "axes": {
    "era": [
      "any"
    ],
    "ruleset": "core"
  },
  "sources": [
    {
      "book_id": "grand-grimoire-en",
      "physical_page": 115,
      "printed_page": 114,
      "method": "book_text",
      "verified": true
    }
  ],
  "quality": {
    "needs_review": false,
    "flags": [
      "translated"
    ],
    "notes": "Только для Страны снов (Grand Grimoire, пометка Dreamlands)."
  }
}
