{
  "schema": "sourcefold.spell.v0",
  "id": "coc:spell:journey-to-the-other-side",
  "kind": "spell",
  "name": {
    "ru": "Путешествие на Ту сторону",
    "en": "Journey to the Other Side"
  },
  "aliases": [
    "Channel Soul to Other Place",
    "Transport Mind",
    "Great Journeying"
  ],
  "category": "Врата и путешествия",
  "cost": {
    "raw": "15 ПМ, 1 Рассудка",
    "magic_points": "15",
    "sanity": "1",
    "pow": null,
    "other": null
  },
  "casting_time": {
    "raw": "1 день"
  },
  "description": {
    "ru": "Долгий ритуал: заклинатель распевает песнопения или выполняет другие повторяющиеся действия, чтобы войти в транс (изменённое состояние сознания). Достигнув его, заклинатель может отправить свой «дух» в иной план бытия — выбранный им самим (если он знает о существовании этого плана и понимает его) или случайный; возможно, даже туда, где обитает божество Мифов, или в Страну грёз. Транс длится 1d6+3 часа. В зависимости от того, куда попадёт дух и что увидит, вероятны потери рассудка — иногда очень большие.",
    "en": null
  },
  "variant_of": null,
  "axes": {
    "era": [
      "any"
    ],
    "ruleset": "core"
  },
  "sources": [
    {
      "book_id": "grand-grimoire-en",
      "physical_page": 132,
      "printed_page": 131,
      "method": "book_text",
      "verified": true
    },
    {
      "book_id": "masks-of-nyarlathotep-en",
      "physical_page": 639,
      "printed_page": 636,
      "method": "book_text",
      "verified": true
    }
  ],
  "quality": {
    "needs_review": false,
    "flags": [
      "translated"
    ],
    "notes": null
  }
}
