{
  "schema": "sourcefold.spell.v0",
  "id": "coc:spell:dissolve-skeleton",
  "kind": "spell",
  "name": {
    "ru": "Растворить скелет",
    "en": "Dissolve Skeleton"
  },
  "aliases": [
    "Liquefy Bones",
    "Touch of the Worm",
    "The Obscene Oozing"
  ],
  "category": "атака",
  "cost": {
    "raw": "8 ПМ, 1d10 Рассудка",
    "magic_points": "8",
    "sanity": "1d10",
    "pow": null,
    "other": null
  },
  "casting_time": {
    "raw": "2 раунда"
  },
  "description": {
    "ru": "Работает только в Стране снов. Если цель проигрывает встречную проверку МОЩ заклинателю, её кости исчезают: она оседает на пол грудой сложенной дрожащей плоти и проходит проверку Рассудка (потеря 1d20/1d20+5). Лишённая опоры, которая держит дыхательные пути открытыми, жертва может задохнуться — или же спутники станут носить «желеобразного» друга в корзинке. На усмотрение Хранителя успешная проверка Сновидения (или другое заклинание) может вернуть жертве кости. Свидетели растворения проходят проверку Рассудка (потеря 1/1d6).",
    "en": null
  },
  "variant_of": null,
  "axes": {
    "era": [
      "any"
    ],
    "ruleset": "core"
  },
  "sources": [
    {
      "book_id": "grand-grimoire-en",
      "physical_page": 98,
      "printed_page": 97,
      "method": "book_text",
      "verified": true
    }
  ],
  "quality": {
    "needs_review": false,
    "flags": [
      "translated"
    ],
    "notes": "Только для Страны снов (Grand Grimoire, пометка Dreamlands)."
  }
}
