{
  "schema": "sourcefold.spell.v0",
  "id": "coc:spell:contact-formless-spawn",
  "kind": "spell",
  "name": {
    "ru": "Связь с бесформенным отродьем",
    "en": "Contact Formless Spawn"
  },
  "aliases": [
    "Связь с бесформенным отродьем Жотаккуа"
  ],
  "category": "Связь",
  "cost": {
    "raw": "3 ПМ, 1d3 Рассудка",
    "magic_points": "3",
    "sanity": "1d3",
    "pow": null,
    "other": null
  },
  "casting_time": {
    "raw": "1d6+4 раунда"
  },
  "description": {
    "ru": "Устанавливает связь с бесформенными отродьями. Заклинание автоматически успешно при условии, что поблизости есть бесформенные отродья. Лучше всего творить его в храме Цатхоггуа, где сохранилась статуя Цатхоггуа, или неподалёку от входа в чёрную бездну Н'кай — например, возле Бингера в штате Оклахома; возможно, точки входа и выхода есть и в других местах на Западе и Среднем Западе США, а по слухам, одна такая пещера находится возле Данвича в штате Массачусетс.\nОбщие правила — «Заклинания связи»: заклинание лишь устанавливает контакт и не даёт власти над гостем. Если поблизости есть такие существа, оно срабатывает автоматически; является случайный представитель вида — через игровой час или позже (время в часах — бросок 1d100), а если путь слишком долог, никто не придёт. Гость волен уйти в любой момент и может предпочесть сожрать заклинателя, а не договариваться. Сотворение стоит 1d3 Рассудка плюс обычная потеря при виде существа.",
    "en": null
  },
  "variant_of": "coc:spell:contact-spells",
  "refs": [
    "coc:creature:formless-spawn"
  ],
  "axes": {
    "era": [
      "any"
    ],
    "ruleset": "core"
  },
  "sources": [
    {
      "book_id": "keeper-rulebook-ru",
      "physical_page": 233,
      "printed_page": 252,
      "method": "book_text",
      "verified": true
    },
    {
      "book_id": "keeper-rulebook-en",
      "physical_page": 252,
      "printed_page": 251,
      "method": "book_text",
      "verified": true
    },
    {
      "book_id": "grand-grimoire-en",
      "physical_page": 80,
      "printed_page": 79,
      "method": "book_text",
      "verified": true
    }
  ],
  "quality": {
    "needs_review": false,
    "flags": [],
    "notes": "Текст по русской КХ. Русский вариант названия — из веб-помощника."
  }
}
