{
  "schema": "sourcefold.spell.v0",
  "id": "coc:spell:chime-of-tezchaptl",
  "kind": "spell",
  "name": {
    "ru": "Колокольчик Тезчаптля",
    "en": "Chime of Tezchaptl"
  },
  "aliases": [
    "The Minstrel’s Backlash",
    "Harmonic Concordance",
    "The Jester’s Bell"
  ],
  "category": "Защита",
  "cost": {
    "raw": "10 ПМ, 10 МОЩ, 1d6 Рассудка",
    "magic_points": "10",
    "sanity": "1d6",
    "pow": "10",
    "other": "колокольчик из чистого металла; обряд «Невыразимое обещание»"
  },
  "casting_time": {
    "raw": "6 часов"
  },
  "description": {
    "ru": "Заклинатель зачаровывает небольшой колокольчик из чистого металла — серебра, золота или железа. За каждые 30 м над уровнем моря, на которых изготовлен колокольчик, его действенность растёт на 1%: сделанный на высоте 1650 м колокольчик срабатывает в 55% случаев. Кроме того, заклинатель должен исполнить «Невыразимое обещание», рискуя рассудком и жизнью.\nКолокольчик защищает от многих заклинаний, требующих пения или музыкальных инструментов (например, Free Hastur, «Песнь Хастура», «Приглушить свет», «Пение души»). Если тихо позвонить в него, он поглощает заклинание при результате 1d100 не выше своего рейтинга. Поглощая магию, металл приобретает особый блеск, а звон меняет тембр. Поглощённая сущность заклинания держится в колокольчике 2d6 минут; за это время владелец может громко позвонить, и энергия заклинания с силой обрушится на исходного заклинателя, нанося 1d6 урона за каждые 2 ПМ цены поглощённого заклинания. Это не требует дополнительной цены или проверок. Зрелище отражённой магии может потребовать проверок Рассудка.",
    "en": null
  },
  "variant_of": null,
  "axes": {
    "era": [
      "any"
    ],
    "ruleset": "core"
  },
  "sources": [
    {
      "book_id": "grand-grimoire-en",
      "physical_page": 66,
      "printed_page": 65,
      "method": "book_text",
      "verified": true
    }
  ],
  "quality": {
    "needs_review": false,
    "flags": [
      "translated"
    ],
    "notes": "Только Grand Grimoire; текст — наш перевод."
  }
}
