{
  "schema": "sourcefold.spell.v0",
  "id": "coc:spell:attune-crystal",
  "kind": "spell",
  "name": {
    "ru": "Настроить кристалл",
    "en": "Attune Crystal"
  },
  "aliases": [
    "Empower Crystal",
    "Mental Acclimatization of the Stone"
  ],
  "category": "зачарование",
  "cost": {
    "raw": "5+ МОЩ, 1d4 Рассудка",
    "magic_points": null,
    "sanity": "1d4",
    "pow": "5+",
    "other": "безупречный кристалл высокого качества"
  },
  "casting_time": {
    "raw": "1+ час"
  },
  "description": {
    "ru": "Позволяет настроить кристалл для заклинания Activation. Кристалл должен быть высокого качества, без изъянов. Каждые 5 МОЩ, вложенные в кристалл (потеря МОЩ постоянна), дают +10% к шансу на успех при сотворении Activation. На каждые 5 вкладываемых МОЩ требуется час сосредоточения. Кристалл остаётся настроенным, пока заклинатель жив. Неизвестно, помогает ли такой кристалл при сотворении похожих заклинаний.",
    "en": null
  },
  "deeper_magic": {
    "ru": "Если вместо земного кристалла использовать кристалл ми-го, каждые 5 вложенных МОЩ дают +20% к шансу на успех Activation.",
    "en": null
  },
  "variant_of": null,
  "axes": {
    "era": [
      "any"
    ],
    "ruleset": "core"
  },
  "sources": [
    {
      "book_id": "grand-grimoire-en",
      "physical_page": 31,
      "printed_page": 30,
      "method": "book_text",
      "verified": true
    }
  ],
  "quality": {
    "needs_review": false,
    "flags": [
      "translated"
    ],
    "notes": "Только Grand Grimoire; текст — наш перевод."
  }
}
