{
  "schema": "sourcefold.spell.v0",
  "id": "coc:spell:incinerate",
  "kind": "spell",
  "name": {
    "ru": "Испепеление",
    "en": "Incinerate"
  },
  "aliases": [
    "Flaming Envelopment",
    "Combustion",
    "The Fiery Death"
  ],
  "category": "атака",
  "cost": {
    "raw": "6 ПМ, 1d6 Рассудка",
    "magic_points": "6",
    "sanity": "1d6",
    "pow": null,
    "other": null
  },
  "casting_time": {
    "raw": "мгновенно"
  },
  "description": {
    "ru": "Действует только на живых существ; выбирается одна цель. Заклинатель проходит с ней встречную проверку МОЩ: если побеждает цель, эффекта нет; если заклинатель — цель получает полный эффект.\nМетаболизм цели ускоряется, порождая невероятный жар, — 1d6 урона каждый раунд. В первом раунде — жар и покрасневшая кожа; во втором — обильный пот и волдыри; на третий и четвёртый внутренние жидкости закипают, и цель корчится в агонии, откашливая дымящуюся желчь, кровь и куски сварившихся органов. Процесс продолжается и после смерти, пока тело не обратится в пепел и осколки костей. Свидетели такой смерти проходят проверку Рассудка (потеря 1/1d6).",
    "en": null
  },
  "variant_of": null,
  "axes": {
    "era": [
      "any"
    ],
    "ruleset": "core"
  },
  "sources": [
    {
      "book_id": "grand-grimoire-en",
      "physical_page": 131,
      "printed_page": 130,
      "method": "book_text",
      "verified": true
    }
  ],
  "quality": {
    "needs_review": false,
    "flags": [
      "translated"
    ],
    "notes": null
  }
}
