{
  "schema": "sourcefold.spell.v0",
  "id": "coc:spell:contact-human",
  "kind": "spell",
  "name": {
    "ru": "Связь с человеком",
    "en": "Contact Human"
  },
  "aliases": [
    "Contact Human (Mi-Go)"
  ],
  "category": "связь",
  "cost": {
    "raw": "3 ПМ",
    "magic_points": "3",
    "sanity": null,
    "pow": null,
    "other": "человек на связи теряет 1 Рассудка за каждые 5 раундов связи после первого"
  },
  "casting_time": {
    "raw": "1 раунд"
  },
  "description": {
    "ru": "Заклинание хитроумных ми-го для мысленного общения со своими слугами-людьми. Устанавливается телепатическая связь с человеком, ранее подвергнутым гипнозу ми-го. Тот, с кем связались, может отвечать, задавать вопросы и т. п. Каждые 5 раундов связи после первого раунда стоят этому человеку 1 Рассудка.",
    "en": null
  },
  "variant_of": "coc:spell:contact-spells",
  "refs": [
    "coc:creature:mi-go"
  ],
  "axes": {
    "era": [
      "any"
    ],
    "ruleset": "core"
  },
  "sources": [
    {
      "book_id": "grand-grimoire-en",
      "physical_page": 80,
      "printed_page": 79,
      "method": "book_text",
      "verified": true
    }
  ],
  "quality": {
    "needs_review": false,
    "flags": [
      "translated"
    ],
    "notes": "Вариант заклинаний связи наоборот: ми-го связываются с человеком."
  }
}
