{
  "schema": "sourcefold.spell.v0",
  "id": "coc:spell:call-dismiss-shub-niggurath",
  "kind": "spell",
  "name": {
    "ru": "Вызов/изгнание Шуб-Ниггурат",
    "en": "Call/Dismiss Shub-Niggurath"
  },
  "aliases": [
    "Call Shub-Niggurath",
    "Вызов Шуб-Ниггурат",
    "The Sacred Rites of Union",
    "Bring Forth The Carnal Desire of the Wood Nymph",
    "Священные обряды единения",
    "Пробудить животную страсть лесной нимфы",
    "Вызвать лесную богиню"
  ],
  "category": "Вызов и изгнание",
  "cost": {
    "raw": "1+ ПМ с каждого участника, 1d10 Рассудка (только заклинатель)",
    "magic_points": "1+ с участника",
    "sanity": "1d10",
    "pow": null,
    "other": null
  },
  "casting_time": {
    "raw": "1–100 минут"
  },
  "description": {
    "ru": "Вызов (общие правила — «Вызов божества»; отослать божество — «Изгнание божества»). Вызывает Шуб-Ниггурат к освящённому каменному алтарю. Алтарь должен находиться в сырой глуши под открытым небом; заклинание нужно сотворить на алтаре в новолуние. При каждом вызове тёмной богини алтарь следует окропить свежей кровью. Омовение алтаря кровью, эквивалентной 200 ТЕЛ и более, добавляет 20% к шансам на успешный вызов, а каждая присутствующая тёмная молодь — ещё по 10%.",
    "en": null
  },
  "variant_of": "coc:spell:call-deity",
  "refs": [
    "coc:creature:shub-niggurath",
    "coc:creature:dark-young-of-shub-niggurath"
  ],
  "axes": {
    "era": [
      "any"
    ],
    "ruleset": "core"
  },
  "sources": [
    {
      "book_id": "keeper-rulebook-ru",
      "physical_page": 229,
      "printed_page": 248,
      "method": "book_text",
      "verified": true
    },
    {
      "book_id": "keeper-rulebook-en",
      "physical_page": 250,
      "printed_page": 249,
      "method": "book_text",
      "verified": true
    },
    {
      "book_id": "grand-grimoire-en",
      "physical_page": 60,
      "printed_page": 59,
      "method": "book_text",
      "verified": true
    }
  ],
  "quality": {
    "needs_review": false,
    "flags": [],
    "notes": "«Вызвать лесную богиню» — название из списка заклинаний книги в КХ (по веб-помощнику)."
  }
}
