{
  "schema": "sourcefold.spell.v0",
  "id": "coc:spell:fist-of-yog-sothoth",
  "kind": "spell",
  "name": {
    "ru": "Кулак Йог-Сотота",
    "en": "Fist of Yog-Sothoth"
  },
  "aliases": [
    "Channel the Strength of the Opener of the Way",
    "Smite Down Thine Enemy",
    "The Hideous Blast of the Foul One",
    "Направить силу открывающего путь",
    "Сокруши ворога своего",
    "Гнусный удар лукавого"
  ],
  "category": "атака",
  "cost": {
    "raw": "ПМ варьируется, 1d6 Рассудка",
    "magic_points": "варьируется",
    "sanity": "1d6",
    "pow": null,
    "other": null
  },
  "casting_time": {
    "raw": "мгновенно"
  },
  "description": {
    "ru": "Заклинатель обрушивает незримый магический удар на одну видимую ему цель. Каждый вложенный ПМ даёт удару 2d10 СИЛ. За каждые 10 метров до цели заклинатель должен дополнительно потратить по 1 ПМ (в английском издании — за каждые 30 футов после первых 30).\nЕсли цель — живое существо, при попадании она проходит встречную проверку ВЫН против СИЛ заклинания; проиграв, она теряет сознание. Независимо от результата цель отбрасывает от заклинателя на расстояние в метрах, равное (СИЛ удара − ТЕЛ цели) ÷ 3.\nЗаклинание можно применять и против СИЛ неодушевлённых предметов, например дверей и стен; результат обычно очевиден, но иногда решение принимает Хранитель.\nПример: заклинатель тратит 5 ПМ, чтобы поразить сыщика в 17 метрах. 1 ПМ уходит на расстояние, ещё 4 дают СИЛ 8d10 — выпадает 57. Сыщик проваливает трудную проверку ВЫН (СИЛ заклинания выше 50) и теряет сознание; при ТЕЛ 45 его отбрасывает на 4 метра.",
    "en": null
  },
  "variant_of": null,
  "refs": [
    "coc:creature:yog-sothoth"
  ],
  "axes": {
    "era": [
      "any"
    ],
    "ruleset": "core"
  },
  "sources": [
    {
      "book_id": "keeper-rulebook-ru",
      "physical_page": 238,
      "printed_page": 257,
      "method": "book_text",
      "verified": true
    },
    {
      "book_id": "keeper-rulebook-en",
      "physical_page": 256,
      "printed_page": 255,
      "method": "book_text",
      "verified": true
    },
    {
      "book_id": "grand-grimoire-en",
      "physical_page": 119,
      "printed_page": 118,
      "method": "book_text",
      "verified": true
    }
  ],
  "quality": {
    "needs_review": false,
    "flags": [],
    "notes": "Расстояние отбрасывания проверено по изображению страницы: «(СИЛ удара − ТЕЛ цели) ÷ 3» метров (в английском издании — СИЛ − ТЕЛ в футах)."
  }
}
