{
  "schema": "sourcefold.spell.v0",
  "id": "coc:spell:breath-of-the-pharaoh",
  "kind": "spell",
  "name": {
    "ru": "Дыхание фараона",
    "en": "Pharaoh's Breath"
  },
  "category": "Атака",
  "cost": {
    "raw": "3 ПМ, 3 Рассудка",
    "magic_points": "3",
    "sanity": "3",
    "pow": null,
    "other": null
  },
  "casting_time": {
    "raw": "мгновенно"
  },
  "description": {
    "ru": "Вариант «Дыхания Пазузу». Заклинатель изрыгает изо рта видимое облако ядовитых испарений, похожее на струю пара. Зловонное дыхание направлено в одну цель на расстоянии до 30 метров, но может задеть и тех, кто рядом. На открытом воздухе пар сразу рассеивается (действует один раунд), а в замкнутом помещении держится, пока не откроют окно или иначе не создадут сквозняк.\nЕсли цель замечает струю пара (например, успешной проверкой Внимания или Слуха), в первом раунде она может попытаться увернуться (Уклонение). Не сумевшая увернуться цель теряет 1d8 ПЗ от удушающего яда; если пар не рассеялся, во втором раунде она теряет 1d6 ПЗ, в третьем — 1d4, в последнем, четвёртом — 1d2. Урон прекращается, если цели удаётся выбраться из облака.\nВсе остальные, кто оказался в облаке, получают по 1d4 урона за раунд в течение 4 раундов.",
    "en": null
  },
  "variant_of": "coc:spell:breath-of-pazzuzu",
  "axes": {
    "era": [
      "any"
    ],
    "ruleset": "core"
  },
  "sources": [
    {
      "book_id": "masks-of-nyarlathotep-en",
      "physical_page": 639,
      "printed_page": 636,
      "method": "book_text",
      "verified": true
    }
  ],
  "quality": {
    "needs_review": false,
    "flags": [
      "translated"
    ],
    "notes": "Английское название по «Маскам Ньярлатхотепа» 7e — Pharaoh's Breath (в инвентаре было восстановленное «Breath of the Pharaoh»). В отличие от «Дыхания Пазузу» в Grand Grimoire, здесь урон по раундам расписан без противоречия: 1d8, 1d6, 1d4, 1d2."
  }
}
