{
  "schema": "sourcefold.spell.v0",
  "id": "coc:spell:contact-chaugnar-faugn",
  "kind": "spell",
  "name": {
    "ru": "Связь с божеством: Шагнер Фан",
    "en": "Contact Chaugnar Faugn"
  },
  "aliases": [
    "Contact Deity: Chaugnar Faugn"
  ],
  "category": "связь",
  "cost": {
    "raw": "5 МОЩ, 1d6 Рассудка",
    "magic_points": null,
    "sanity": "1d6",
    "pow": "5",
    "other": null
  },
  "casting_time": {
    "raw": "1d6+4 раунда"
  },
  "description": {
    "ru": "Позволяет связаться с Шагнер Фаном (общие правила — «Связь с божеством»). При успехе божество посылает заклинателю видения или кошмарные сны, в которых выражает свою волю или даёт понять, будет ли мольба сновидца принята или отвергнута.\nПо Grand Grimoire, заклинатель должен приготовить роскошное, обильное угощение в честь Великого Древнего и объедаться им, пока не сможет больше есть и не лишится чувств.",
    "en": null
  },
  "variant_of": "coc:spell:contact-deity",
  "refs": [
    "coc:creature:chaugnar-faugn"
  ],
  "axes": {
    "era": [
      "any"
    ],
    "ruleset": "core"
  },
  "sources": [
    {
      "book_id": "keeper-rulebook-ru",
      "physical_page": 235,
      "printed_page": 254,
      "method": "book_text",
      "verified": true
    },
    {
      "book_id": "keeper-rulebook-en",
      "physical_page": 253,
      "printed_page": 252,
      "method": "book_text",
      "verified": true
    },
    {
      "book_id": "grand-grimoire-en",
      "physical_page": 74,
      "printed_page": 73,
      "method": "book_text",
      "verified": true
    }
  ],
  "quality": {
    "needs_review": false,
    "flags": [],
    "notes": "Второй абзац — по Grand Grimoire (наш перевод)."
  }
}
