{
  "schema": "sourcefold.spell.v0",
  "id": "coc:spell:summon-bind-nightgaunt",
  "kind": "spell",
  "name": {
    "ru": "Призыв/укрощение ночного призрака",
    "en": "Summon/Bind Nightgaunt"
  },
  "aliases": [
    "Summon Nightgaunt",
    "Bind Nightgaunt",
    "The Whispered Words of the Faceless Men",
    "Conjure the Winged Shadow",
    "Mastery of the Faceless Ones",
    "The Elder Token by which They will Know You",
    "Призыв ночного призрака",
    "Укрощение ночного призрака",
    "Шёпот безликого",
    "Воплощение крылатой тени",
    "Власть над безликими",
    "Символ Старших богов да позволит им узнать тебя",
    "Повелевать безликим"
  ],
  "category": "Призыв и укрощение",
  "cost": {
    "raw": "варьируется (1 ПМ за каждые 10% шанса), 1d4 Рассудка; отдельное укрощение — 1 Рассудка",
    "magic_points": "варьируется",
    "sanity": "1d4",
    "pow": null,
    "other": null
  },
  "casting_time": {
    "raw": "5 минут за каждый потраченный ПМ; укрощение — 1 раунд"
  },
  "description": {
    "ru": "Призывает одного ночного призрака: почти бесшумный порыв ветра — и перед заклинателем появляется жуткая безликая крылатая тварь. Для призыва нужен камень с вырезанным тайным знаком Старших богов (сам камень не обязан быть в форме звезды); заклинание можно сотворить только безлунной ночью.\nУкрощение ночного призрака: если у заклинателя есть камень со знаком Старших богов, он получает одну бонусную кость к встречной проверке МОЩ на укрощение.\nОбщие правила — «Заклинания призыва»: 1 ПМ за каждые 10% шанса на успех, по 5 минут речитатива за каждый ПМ; 96–100 — всегда провал (100 — с дурными последствиями); каждое сотворение стоит 1d4 Рассудка. При успехе существо появляется через 2d10 минут после окончания речитатива. По решению Хранителя оно прибывает уже укрощённым либо заклинатель проходит встречную проверку МОЩ: при провале тварь атакует его и уходит. Отдельное укрощение — 1 раунд, 1 Рассудка и встречная проверка МОЩ (цель видна и не дальше 100 метров; вложив ПМ, равные 1/5 МОЩ твари, заклинатель получает бонусную кость). Укрощённая тварь выполняет один конкретный ограниченный по времени приказ (не длиннее 1/5 её ИНТ в словах) и освобождается.",
    "en": null
  },
  "variant_of": "coc:spell:summon-bind",
  "refs": [
    "coc:creature:nightgaunt"
  ],
  "axes": {
    "era": [
      "any"
    ],
    "ruleset": "core"
  },
  "sources": [
    {
      "book_id": "keeper-rulebook-ru",
      "physical_page": 232,
      "printed_page": 251,
      "method": "book_text",
      "verified": true
    },
    {
      "book_id": "keeper-rulebook-en",
      "physical_page": 264,
      "printed_page": 263,
      "method": "book_text",
      "verified": true
    },
    {
      "book_id": "grand-grimoire-en",
      "physical_page": 43,
      "printed_page": 42,
      "method": "book_text",
      "verified": true
    },
    {
      "book_id": "grand-grimoire-en",
      "physical_page": 177,
      "printed_page": 176,
      "method": "book_text",
      "verified": true
    }
  ],
  "quality": {
    "needs_review": false,
    "flags": [],
    "notes": "Текст по русской КХ (призыв и укрощение ночного призрака, общие правила призыва на стр. 250–251). «Повелевать безликим» — название в гримуаре «О природе чудовищ» по веб-помощнику."
  }
}
