{
  "schema": "sourcefold.spell.v0",
  "id": "coc:spell:maws-of-pandemonium",
  "kind": "spell",
  "name": {
    "ru": "Пасти Пандемониума",
    "en": "Maws of Pandemonium"
  },
  "aliases": [
    "The Screaming Curse",
    "Unholy Sprouting",
    "Gibbering Calamity"
  ],
  "category": "атака",
  "cost": {
    "raw": "переменное число ПМ (6 ПМ за каждый рот), 1d8 Рассудка",
    "magic_points": "6 за рот",
    "sanity": "1d8",
    "pow": null,
    "other": null
  },
  "casting_time": {
    "raw": "3 раунда"
  },
  "description": {
    "ru": "Работает только в Стране снов. На теле цели вырастают бормочущие рты — по 6 ПМ за каждый. Заклинатель должен выиграть встречную проверку МОЩ; тогда на теле цели появляются один или несколько красногубых ртов, которые непрерывно бормочут и стонут, а также высасывают ПМ — по 1 в минуту. Когда ПМ доходят до нуля, цель теряет сознание; в этот момент она может пройти проверку МОЩ: при Экстремальном успехе рты затягиваются и исчезают, пока она спит. Иначе рты лишь затихают на 2d6 часов, а затем снова начинают выть и высасывать восстановившиеся ПМ. Попытку Экстремальной проверки МОЩ можно повторять каждый раз, когда жертва лишается всех ПМ и падает без сознания.\nПока рты активны, проверки Скрытности и любые попытки действовать скрытно бесполезны.",
    "en": null
  },
  "variant_of": null,
  "axes": {
    "era": [
      "any"
    ],
    "ruleset": "core"
  },
  "sources": [
    {
      "book_id": "grand-grimoire-en",
      "physical_page": 140,
      "printed_page": 139,
      "method": "book_text",
      "verified": true
    }
  ],
  "quality": {
    "needs_review": false,
    "flags": [
      "translated"
    ],
    "notes": "Только для Страны снов (Grand Grimoire, пометка Dreamlands)."
  }
}
