{
  "schema": "sourcefold.spell.v0",
  "id": "coc:spell:banish-thy-name",
  "kind": "spell",
  "name": {
    "ru": "Изгнать имя",
    "en": "Banish Thy Name"
  },
  "aliases": [
    "Removal",
    "Cast Away from this Mortal Plane",
    "The Hideous Wickedness"
  ],
  "category": "Проклятие",
  "cost": {
    "raw": "12 ПМ, 1d4 Рассудка (каждую ночь)",
    "magic_points": "12",
    "sanity": "1d4",
    "pow": null,
    "other": "освящённая прямоугольная шёлковая бумага"
  },
  "casting_time": {
    "raw": "1+ ночь"
  },
  "description": {
    "ru": "С помощью истинного имени цели заклинатель изгоняет её из бытия. В ночь новолуния он готовит особым образом освящённую прямоугольную шёлковую бумагу и, произнося вслух истинное имя цели (полное имя от рождения), пишет на ней имя конкретного человека или существа. Каждую ночь заклинатель час нараспев повторяет имя, пока цель спит, и каждую ночь вкладывает 12 ПМ и теряет 1d4 Рассудка.\nКаждую ночь проводится встречная проверка МОЩ заклинателя против цели. При успехе цель теряет 30 пунктов СИЛ, ЛВК, ТЕЛ, ВЫН, ИНТ и МОЩ (распределённых по возможности поровну) и страдает от жутких кошмаров. При провале заклинатель теряет ещё 1d4 Рассудка. Так продолжается, пока СИЛ, ЛВК, ТЕЛ, ВЫН, ИНТ и МОЩ цели не упадут до нуля — тогда она исчезает из бытия, — если только заклинателю не помешают или он сам не остановится. Если заклинание не доведено до конца, характеристики цели восстанавливаются при постельном режиме (по 30 пунктов в день до исходных значений).\nЦель, слабеющая с каждым днём, может догадаться, что на ней проклятие, и попытаться найти заклинателя; со смертью заклинателя потеря характеристик прекращается.",
    "en": null
  },
  "variant_of": null,
  "axes": {
    "era": [
      "any"
    ],
    "ruleset": "core"
  },
  "sources": [
    {
      "book_id": "grand-grimoire-en",
      "physical_page": 37,
      "printed_page": 36,
      "method": "book_text",
      "verified": true
    }
  ],
  "quality": {
    "needs_review": false,
    "flags": [
      "translated"
    ],
    "notes": "Только Grand Grimoire; текст — наш перевод."
  }
}
