{
  "schema": "sourcefold.spell.v0",
  "id": "coc:spell:bind-soul",
  "kind": "spell",
  "name": {
    "ru": "Пленить душу",
    "en": "Bind Soul"
  },
  "aliases": [
    "Soul Wrenching of Eibon",
    "Imprison Life Force",
    "The Black Murder"
  ],
  "category": "Создание существ",
  "cost": {
    "raw": "10 ПМ, 5 МОЩ, 3 Рассудка",
    "magic_points": "10",
    "sanity": "3",
    "pow": "5",
    "other": null
  },
  "casting_time": {
    "raw": "3+ дня"
  },
  "description": {
    "ru": "Позволяет заточить человеческую душу и тем самым управлять телом, из которого она взята, или убить его. Сначала заклинатель должен отыскать душу.\nЧтобы заклинание подействовало, нужна встречная проверка МОЩ заклинателя и цели. Другой способ — духовный бой: заклинатель доводит ПМ духа цели до нуля и затем творит заклинание. Если душа поймана, тело цели начинает умирать, теряя по 10 ВЫН в день; когда ВЫН достигнет нуля, тело умирает. Заклинание часто применяют вместе с «Подчинить плоть».\nДля души нужно заранее подготовить особый сосуд (ритуал занимает три дня) — подойдёт всё, что закрывается: кувшин, шкатулка, бутылка. Если сосуд найти и открыть или разбить, душа освобождается и дальше поступает как пожелает.\n«Порошок Ибн-Гази» и подобная магия позволяют проследить связь между телом и душой: место сосуда можно вычислить триангуляцией или, истратив много порошка, просто пройти вдоль ставшей видимой паутинообразной нити.",
    "en": null
  },
  "variant_of": null,
  "axes": {
    "era": [
      "any"
    ],
    "ruleset": "core"
  },
  "sources": [
    {
      "book_id": "grand-grimoire-en",
      "physical_page": 42,
      "printed_page": 41,
      "method": "book_text",
      "verified": true
    }
  ],
  "quality": {
    "needs_review": false,
    "flags": [
      "translated"
    ],
    "notes": null
  }
}
