{
  "schema": "sourcefold.spell.v0",
  "id": "coc:spell:control-elements",
  "kind": "spell",
  "name": {
    "ru": "Управлять стихиями",
    "en": "Control Elements"
  },
  "aliases": [
    "Marshal Nature’s Cruelty",
    "The Primordial Havok",
    "Succor of the Elementals"
  ],
  "category": "окружающая среда",
  "cost": {
    "raw": "8+ ПМ, 1d8 Рассудка",
    "magic_points": "8+",
    "sanity": "1d8",
    "pow": null,
    "other": "образец стихии в руках заклинателя"
  },
  "casting_time": {
    "raw": "10 минут"
  },
  "description": {
    "ru": "Могущественное заклинание, дающее власть над землёй, ветром, огнём или водой: земля может трястись и раскалываться, ветер — крепчать до разрушительной силы, огонь — стремительно распространяться, вода — вздыматься смертоносными волнами или водоворотами и т. п. Заклинание одно для всех четырёх стихий (с небольшим изменением под каждую), но творить его нужно отдельно для каждой стихии. Заклинатель должен держать в руках образец или частицу нужной стихии.\nКаждые 8 вложенных ПМ увеличивают радиус действия на 10 м. При базовом сотворении СИЛ стихии равна 125; каждый ПМ сверх 8, потраченный при сотворении, добавляет 10 СИЛ. Действие длится 1d10+5 минут. Каждый раунд стихия наносит всем (кроме заклинателя) в радиусе действия урон, равный своему бонусу к урону, который считается только по СИЛ (ТЕЛ у стихии нет): например, столб воды с СИЛ 125 наносит 1d4 за раунд, огонь с СИЛ 165 — 1d6. Естественно, чем сильнее стихия, тем сильнее её воздействие на окружающее.",
    "en": null
  },
  "variant_of": null,
  "axes": {
    "era": [
      "any"
    ],
    "ruleset": "core"
  },
  "sources": [
    {
      "book_id": "grand-grimoire-en",
      "physical_page": 82,
      "printed_page": 81,
      "method": "book_text",
      "verified": true
    }
  ],
  "quality": {
    "needs_review": false,
    "flags": [
      "translated"
    ],
    "notes": "Только Grand Grimoire; текст — наш перевод."
  }
}
