{
  "schema": "sourcefold.spell.v0",
  "id": "coc:spell:move-gate",
  "kind": "spell",
  "name": {
    "ru": "Переместить врата",
    "en": "Move Gate"
  },
  "aliases": [
    "Reshape Destiny",
    "Transform Sigils of Journeying",
    "Transition Shifting"
  ],
  "category": "врата",
  "cost": {
    "raw": "переменное число МОЩ, 1 ПЗ",
    "magic_points": null,
    "sanity": null,
    "pow": "варьируется",
    "other": "1 ПЗ (кровь заклинателя)"
  },
  "casting_time": {
    "raw": "1 час"
  },
  "description": {
    "ru": "Позволяет перехватить существующие врата (Gate) и перенаправить их в другое место. Заклинатель должен точно знать, куда ведут исходные врата (догадки недостаточно), и знать место, куда хочет их перевести (бывать там не обязательно). Своей кровью (1 ПЗ) он перечерчивает знаки врат, жертвуя МОЩ, чтобы навсегда изменить их место назначения.\nНовое место назначения должно быть ближе к заклинателю, чем исходное: заклинание не увеличивает дальность врат, а лишь даёт им более близкую цель. Так, врата на 1600 км можно перевести только в место ближе 1600 км.\nЦена в МОЩ — половина того, что пришлось бы заплатить за создание новых врат с нуля (таблица стоимости создания врат и перехода, Grand Grimoire, с. 122). Пример: врата ведут за 16 000 км, а заклинатель хочет перевести их в место в 1600 км; создание таких врат с нуля стоило бы 10 МОЩ, значит, перемещение обойдётся в 5 МОЩ.",
    "en": null
  },
  "variant_of": null,
  "axes": {
    "era": [
      "any"
    ],
    "ruleset": "core"
  },
  "sources": [
    {
      "book_id": "grand-grimoire-en",
      "physical_page": 144,
      "printed_page": 143,
      "method": "book_text",
      "verified": true
    }
  ],
  "quality": {
    "needs_review": false,
    "flags": [
      "translated"
    ],
    "notes": null
  }
}
