{
  "schema": "sourcefold.spell.v0",
  "id": "coc:spell:steal-life",
  "kind": "spell",
  "name": {
    "ru": "Похищение жизненной силы",
    "en": "Steal Life"
  },
  "aliases": [
    "Leech Vitality",
    "The Rite in Crimson",
    "The Blasphemous Sacrament of the Five Cuts"
  ],
  "category": "кража жизни",
  "cost": {
    "raw": "15 ПМ, 1d20 Рассудка",
    "magic_points": "15",
    "sanity": "1d20",
    "pow": null,
    "other": null
  },
  "casting_time": {
    "raw": "1+ раунд"
  },
  "description": {
    "ru": "Дьявольски жестокое заклинание: высасывает жизнь из жертвы, омолаживая заклинателя. Творится в полнолуние; цель должна быть в пределах видимости и слышимости заклинателя. Заклинатель должен победить цель во встречной проверке МОЩ; при успехе цель начинает стареть и разлагаться, а её жизненную силу поглощает заклинатель.\nКаждый раунд после сотворения цель теряет по 1d10 СИЛ, ВЫН, ЛВК, МОЩ и НАР. За каждый вытянутый пункт характеристик заклинатель молодеет на день (например, 40 пунктов — на 40 дней). Жертва иссыхает, её плоть сереет и шелушится, и в конце от неё остаётся жуткая сухая оболочка (свидетели проходят проверку рассудка 1/1d6).\nЗаклинатель может прекратить заклинание в любой момент до смерти жертвы — чем дольше оно длилось, тем хуже её состояние (бледная, похожая на бумагу кожа, иссохшие узловатые конечности и т. п.). Если заклинателя убьют раньше, чем умрёт жертва, заклинание отменяется, и жертва сразу возвращает все потерянные пункты характеристик.\nВ «Масках Ньярлатхотепа»: цель каждый раунд теряет 1d10 пунктов в сумме, распределяя потерю как можно равномернее между СИЛ, ВЫН, ЛВК, МОЩ и НАР (а не по 1d10 каждой); в Луну охотника — 10 пунктов за раунд.",
    "en": null
  },
  "deeper_magic": {
    "ru": "Заклинание можно творить и не в полнолуние: тогда заклинатель не молодеет, но жертва всё равно страдает и, если он пожелает, умирает. В Луну охотника (первое полнолуние после осеннего равноденствия) заклинатель вытягивает максимум — по 10 пунктов СИЛ, ВЫН, ЛВК, МОЩ и НАР за раунд вместо 1d10. Ещё один вариант позволяет обращать вытянутые пункты характеристик прямо в МОЩ: 1 МОЩ за каждые 5 пунктов.",
    "en": null
  },
  "variant_of": null,
  "axes": {
    "era": [
      "any"
    ],
    "ruleset": "core"
  },
  "sources": [
    {
      "book_id": "grand-grimoire-en",
      "physical_page": 174,
      "printed_page": 173,
      "method": "book_text",
      "verified": true
    },
    {
      "book_id": "masks-of-nyarlathotep-en",
      "physical_page": 640,
      "printed_page": 637,
      "method": "book_text",
      "verified": true
    }
  ],
  "quality": {
    "needs_review": false,
    "flags": [
      "translated"
    ],
    "notes": "В «Масках» 7e (с. 637) — вариант: цель теряет за раунд 1d10 пунктов в сумме, распределённых как можно равномернее между СИЛ, ВЫН, ЛВК, МОЩ и НАР, а не по 1d10 каждой характеристики (GG)."
  }
}
